I type
II subject
III enveroment
IV  items
V teacherp
VI teachern
VII teacher

INSERT INTO type (id, name_) VALUES
(1,'Lesson'),
(2,'Seminar');

SHOW COLUMNS FROM subject;

+----------+-------------+------+-----+---------+----------------+
| Field    | Type        | Null | Key | Default | Extra          |
+----------+-------------+------+-----+---------+----------------+
| id       | int         | NO   | PRI | NULL    | auto_increment |
| name_v   | varchar(10) | NO   |     | NULL    |                |
| platform | varchar(20) | NO   |     | NULL    |                |
| type_id  | int         | NO   | MUL | NULL    |                |
| number   | int         | NO   |     | NULL    |                |
+----------+-------------+------+-----+---------+----------------+

ALTER TABLE subject MODIFY COLUMN name_v VARCHAR(20) NOT NULL;

INSERT INTO subject (name_v, platform, type_id, number) VALUES
('MYSQL_L1.mp4', 'GB', 1, 1);

+----+--------------+----------+---------+--------+
| id | name_v       | platform | type_id | number |
+----+--------------+----------+---------+--------+
|  1 | MYSQL_L1.mp4 | GB       |       1 |      1 |
+----+--------------+----------+---------+--------+

ALTER TABLE subject ALTER COLUMN platform SET DEFAULT "GB";



ALTER TABLE subject MODIFY COLUMN name_v VARCHAR(20) NOT NULL;


CREATE TABLE topic (
id INT NOT NULL AUTO_INCREMENT,
PRIMARY KEY(id),
name TINYTEXT NOT NULL
)ENGINE=INNODB;

ALTER TABLE items RENAME COLUMN topic TO topic_id; /изменили имя столбца

ALTER TABLE items
ADD CONSTRAINT items_topicfk FOREIGN KEY (`topic_id`) REFERENCES topic(`id`); /добавили связь между таблицами

RENAME TABLE teachern TO teacherf; /переименование таблицы

ALTER TABLE teacher RENAME COLUMN name_id TO fname_id; /переименование столбца

SELECT t.*, f.* FROM teacher t RIGHT JOIN teacherf f ON f.id = t.fname_id; /RIGHT JOIN с выводом всех столбцов обеих таблиц

INSERT INTO topic (id) VALUES (null); /внесение в таблицу установленных по умолчанию данных одновременно во все поля (проверено, что работает только при установлении primary key значения auto incriment);

ALTER TABLE teacher MODIFY COLUMN id INT NOT NULL AUTO_INCREMENT; /установка свойства AUTO_INCREMENT


SELECT ProductName, ProductCount,                   /ПРИМЕР ИСПОЛЬЗОВАНИЕ CASE
    -> CASE
    -> WHEN ProductCount = 1
    -> THEN 'Товар заканчивается'
    -> WHEN ProductCount = 2
    -> THEN 'Мало товара'
    -> WHEN ProductCount = 3
    -> THEN 'Есть в наличии'
    -> ELSE 'Много товара'
    -> END AS Category
    -> FROM Products;
+-------------+--------------+---------------------+
| ProductName | ProductCount | Category            |
+-------------+--------------+---------------------+
| iPhoneX     |            3 | Есть в наличии      |
| iPhone8     |            2 | Мало товара         |
| Galaxv S9   |            2 | Мало товара         |
| GalaxvS8    |            1 | Товар заканчивается |
| P20Pro      |            5 | Много товара        |
+-------------+--------------+---------------------+
5 rows in set (0.00 sec)


 SELECT ProductName, Manufacturer,							/ПРИМЕР ИСПОЛЬЗОВАНИЯ IF
    -> If(ProductCount > 3, 'Много товара', 'Мало товара')
    -> FROM Products;
+-------------+--------------+-----------------------------------------------------+
| ProductName | Manufacturer | If(ProductCount > 3, 'Много товара', 'Мало товара') |
+-------------+--------------+-----------------------------------------------------+
| iPhoneX     | Aool         | Мало товара                                         |
| iPhone8     | Aoole        | Мало товара                                         |
| Galaxv S9   | Samsuno      | Мало товара                                         |
| GalaxvS8    | Samsuno      | Мало товара                                         |
| P20Pro      | Huawei       | Много товара                                        |
+-------------+--------------+-----------------------------------------------------+
5 rows in set (0.00 sec)

UPDATE Products										
    -> SET Price = Price + 3000;
Query OK, 5 rows affected (0.00 sec)
Rows matched: 5  Changed: 5  Warnings: 0 /ПРИМЕР ИСЕОЛЬЗОВАНИЯ UPDATE (УВЕЛИЧИЛИ ЗНАЧЕНИЕ ПОЛЯ Price на 3000)

mysql> SELECT * FROM Products;
+----+-------------+--------------+--------------+-------+
| Id | ProductName | Manufacturer | ProductCount | Price |
+----+-------------+--------------+--------------+-------+
|  1 | iPhoneX     | Aool         |            3 | 79000 |
|  2 | iPhone8     | Aoole        |            2 | 54000 |
|  3 | Galaxv S9   | Samsuno      |            2 | 59000 |
|  4 | GalaxvS8    | Samsuno      |            1 | 44000 |
|  5 | P20Pro      | Huawei       |            5 | 39000 |
+----+-------------+--------------+--------------+-------+
5 rows in set (0.00 sec)

													/ПРИМЕР УДАЛЕНИЯ ЗАПИСЕЙ ИМЕЮЩИХ ЗНАЧЕНИЕ 'Aool' в поле Manufacturer
 DELETE FROM products
    -> WHERE Manufacturer = 'Aool';
Query OK, 1 row affected (0.00 sec)

mysql> SELECT * FROM Products;
+----+-------------+--------------+--------------+-------+
| Id | ProductName | Manufacturer | ProductCount | Price |
+----+-------------+--------------+--------------+-------+
|  2 | iPhone8     | Aoole        |            2 | 54000 |
|  3 | Galaxv S9   | Samsuno      |            2 | 59000 |
|  4 | GalaxvS8    | Samsuno      |            1 | 44000 |
|  5 | P20Pro      | Huawei       |            5 | 39000 |
+----+-------------+--------------+--------------+-------+
4 rows in set (0.00 sec)


UPDATE Products SET Manufacturer = 'Apple' WHERE Manufacturer = 'Aoole'; /обновили значение поля





mysql> SELECT * FROM Products
    -> WHERE NOT Manufacturer = 'Samsung'; / ИСПОЛЬЗОВАНИЕ В ЗАПРОСЕ ОТРИЦАНИЯ - NOT (ВЫВОД ВСЕХ МАРОК КРОМЕ САМСУТГ)
+----+-------------+--------------+--------------+-------+
| Id | ProductName | Manufacturer | ProductCount | Price |
+----+-------------+--------------+--------------+-------+
|  2 | iPhone8     | Apple        |            2 | 54000 |
|  5 | P20Pro      | Huawei       |            5 | 39000 |
|  6 | iPhone X    | Apple        |            3 | 76000 |
+----+-------------+--------------+--------------+-------+
3 rows in set (0.00 sec)



mysql> SELECT * FROM Products
    -> WHERE Manufacturer IN ('Apple', 'Samsung'); / ПРИМЕР ИСПОЛЬЗОВАНИЯ IN
+----+-------------+--------------+--------------+-------+
| Id | ProductName | Manufacturer | ProductCount | Price |
+----+-------------+--------------+--------------+-------+
|  2 | iPhone8     | Apple        |            2 | 54000 |
|  3 | Galaxv S9   | Samsung      |            2 | 59000 |
|  4 | GalaxvS8    | Samsung      |            1 | 44000 |
|  6 | iPhone X    | Apple        |            3 | 76000 |
+----+-------------+--------------+--------------+-------+
4 rows in set (0.00 sec)

ALTER TABLE movies ADD language VARCHAR(20); /ДОБАВИТЬ СТОЛБЕЦ

ALTER TABLE movies DROP COLUMN language; /УДАЛИТЬ СТОЛБЕЦ

ALTER TABLE movies ADD FOREIGN KEY (id_director) REFERENCES directors (id); /ДОБАВИТЬ СВЯЗЬ МЕЖДУ ИМЕЮЩИМИСЯ УЖЕ СТОЛБЦАМИ ТАБЛИЦ (ТАБЛИ1А 1 СТОЛБЕЦ - id_directors, ТАБЛИЦА 2 СТОЛБЕЦ id) id (тип int) - ЯВЛЯЕСЯ ПЕРВИЧНЫМ КЛЮЧОМ ТАБЛИЦИ movies, а id_director (имеет тип int) является полем таблицы derectors

SELECT title AS TITLE, time AS TIME, CASE WHEN time >= 160 AND time 
< 170 THEN "CENTER" END AS timer FROM movies LEFT JOIN directors ON id_director = directors.id; /ИСПОЛЬЗОВАНИЕ CASE


SELECT title AS TITLE, time AS TIME, CASE WHEN time >= 160 AND time < 170 THEN "CENTER" WHEN time >= 142 AND time < 160 THEN "MIN" WHEN time > 170 THEN "BIG" END AS timer FROM movies LEFT JOIN directors ON id_director = directors.id;
+-----------------------------------------+------+--------+
| TITLE                                   | TIME | timer  |
+-----------------------------------------+------+--------+
| Harry Potter and the Philosophers Stone |  152 | MIN    |
| Harry Potter and the Chamber of Secrets |  162 | CENTER |
| The Green Mile                          |  188 | BIG    |
| Forrest Gump                            |  142 | MIN    |
+-----------------------------------------+------+--------+
4 rows in set (0.00 sec)                                     /ИСПОЛЬЗОВАНИЕ CASE


SELECT title AS TITLE, time AS TIME, CASE WHEN time >= 160 AND time
    -> < 170 THEN time *1.2 WHEN time >= 142 AND time < 160 THEN time * 1.1 WHEN time > 170 THEN time * 1.3 END AS timer FROM movies LEFT JOIN directors ON id_director = directors.id;
+-----------------------------------------+------+-------+
| TITLE                                   | TIME | timer |
+-----------------------------------------+------+-------+
| Harry Potter and the Philosophers Stone |  152 | 167.2 |
| Harry Potter and the Chamber of Secrets |  162 | 194.4 |
| The Green Mile                          |  188 | 244.4 |
| Forrest Gump                            |  142 | 156.2 |
+-----------------------------------------+------+-------+
4 rows in set (0.00 sec)  /ЕЩЕ ПРИМЕР ИСПОЛЬЗОВАНИЯ CASE


mysql> SELECT title, time, if (time < 160, 'yes', 'no') FROM movies LEFT JOIN directors ON id_director = directors.id;
+-----------------------------------------+------+------------------------------+
| title                                   | time | if (time < 160, 'yes', 'no') |
+-----------------------------------------+------+------------------------------+
| Harry Potter and the Philosophers Stone |  152 | yes                          |
| Harry Potter and the Chamber of Secrets |  162 | no                           |
| The Green Mile                          |  188 | no                           |
| Forrest Gump                            |  142 | yes                          |
+-----------------------------------------+------+------------------------------+
4 rows in set (0.00 sec)  /ПРИМЕР ИСПОЛЬЗОВАНИЯ IF

 SELECT title, time, if (time < 160, 'yes', 'no') AS 'RESULT' FROM movies LEFT JOIN directors ON id_director = directors.id;
+-----------------------------------------+------+--------+
| title                                   | time | RESULT |
+-----------------------------------------+------+--------+
| Harry Potter and the Philosophers Stone |  152 | yes    |
| Harry Potter and the Chamber of Secrets |  162 | no     |
| The Green Mile                          |  188 | no     |
| Forrest Gump                            |  142 | yes    |
+-----------------------------------------+------+--------+
4 rows in set (0.00 sec) /ПРИМЕР ИСПОЛЬЗОВАНИЯ IF С ПЕРЕИМЕНОВАНИЕ РЕЗУЛЬТИРУЮЩЕГО СТОЛБЦА В 'RESULT'
mysql> SELECT * FROM products ORDER BY Price;
+----+-------------+--------------+--------------+-------+
| Id | ProductName | Manufacturer | ProductCount | Price |
+----+-------------+--------------+--------------+-------+
|  5 | P20Pro      | Huawei       |            5 | 39000 |
|  4 | GalaxvS8    | Samsung      |            1 | 44000 |
|  2 | iPhone8     | Apple        |            2 | 54000 |
|  3 | Galaxv S9   | Samsung      |            2 | 59000 |
|  6 | iPhone X    | Apple        |            3 | 76000 |
+----+-------------+--------------+--------------+-------+
5 rows in set (0.00 sec) / ПРИМЕР СОРТИРОВКИ С ПОМОЩЬЮ ОПЕРАТОРА ORDER BY


 SELECT ProductName, ProductCount * Price AS SUM FROM puoducts ORDER BY SUM;
ERROR 1146 (42S02): Table 'proba.puoducts' doesn't exist
mysql> SELECT ProductName, ProductCount * Price AS SUM FROM products ORDER BY SUM;
+-------------+--------+
| ProductName | SUM    |
+-------------+--------+
| GalaxvS8    |  44000 |
| iPhone8     | 108000 |
| Galaxv S9   | 118000 |
| P20Pro      | 195000 |
| iPhone X    | 228000 |
+-------------+--------+
5 rows in set (0.00 sec) / ПРИМЕР СОРТИРОВКИ С ПРЕДВАРИТЕЛЬНЫМ ДЕЙСТВИЕМ УМНОЖЕНИЯ ПРИ ИСПОЛЬЗОВАНИИ ПСЕВДОНИМОВ

mysql> SELECT * FROM products LIMIT 2;
+----+-------------+--------------+--------------+-------+
| Id | ProductName | Manufacturer | ProductCount | Price |
+----+-------------+--------------+--------------+-------+
|  2 | iPhone8     | Apple        |            2 | 54000 |
|  3 | Galaxv S9   | Samsung      |            2 | 59000 |
+----+-------------+--------------+--------------+-------+
2 rows in set (0.00 sec) /пример использования LIMIT 2 для вывода только первых 2 строк таблицы products

mysql> SELECT * FROM products ORDER BY Price LIMIT 2;
+----+-------------+--------------+--------------+-------+
| Id | ProductName | Manufacturer | ProductCount | Price |
+----+-------------+--------------+--------------+-------+
|  5 | P20Pro      | Huawei       |            5 | 39000 |
|  4 | GalaxvS8    | Samsung      |            1 | 44000 |
+----+-------------+--------------+--------------+-------+
2 rows in set (0.00 sec) /пример использования ORDER BY ДЛЯ СОРТИРОВКИ ПО УБЫВАНИЮ И ОДНОВРЕМЕННО LIMIT 2 для вывода только первых 2 строк таблицы products

mysql> SELECT * FROM products ORDER BY Price LIMIT 2, 2;
+----+-------------+--------------+--------------+-------+
| Id | ProductName | Manufacturer | ProductCount | Price |
+----+-------------+--------------+--------------+-------+
|  2 | iPhone8     | Apple        |            2 | 54000 |
|  3 | Galaxv S9   | Samsung      |            2 | 59000 |
+----+-------------+--------------+--------------+-------+
2 rows in set (0.00 sec) /пример использования ORDER BY ДЛЯ СОРТИРОВКИ ПО УБЫВАНИЮ И ОДНОВРЕМЕННО LIMIT 2, 2 для вывода только двух строк начиная со второй строки таблицы products

UPDATE products SET Price = CASE ProductName WHEN 'iPhone 7' THEN 32000 WHEN 'iPhone8' THEN 51000 WHEN "Galaxv S9" THEN 56000 WHEN 'GalaxvS8' THEN 46000 END WHERE ProductName IN ('iPhone 7','iPhone8',"Galaxv S9",'GalaxvS8'); /ЗАПРОС НА ИЗМЕНЕНИЕ ДАННЫХ В ЗАВИСИМОСТИ ОТ ЗНАЧЕНИЯ НАИМЕНОВАНИЯ ТОВАРА

SELECT Manufacturer, COUNT(*) AS CountModels FROM Products GROUP BY Manufacturer;
+--------------+-------------+
| Manufacturer | CountModels |
+--------------+-------------+
| Apple        |           3 |
| Samsung      |           2 |
| Huawei       |           2 |
| HMD Global   |           1 |
+--------------+-------------+
4 rows in set (0.00 sec)        /использования функции COUNT для подсчета количества товара каждой модели и использование оператора GROUP BY для групировки по полю Manufacturer, с выводом результата в созднном поле CountModel


 SELECT AVG(Price) AS Average_Price FROM Products;
+---------------+
| Average_Price |
+---------------+
|    45750.0000 |
+---------------+
1 row in set (0.00 sec) /использование агрегатной функции AVG ДЛЯ ВЫВОДА СРЕДНЕГО ЗНАЧЕНИЯ СТОЛБЦА Price в созданном дополнительном столбце Average_Price

SELECT AVG(Price) AS Average_Price FROM Products WHERE Manufacturer = 'Apple' ;
+---------------+
| Average_Price |
+---------------+
|    53000.0000 |
+---------------+
1 row in set (0.00 sec) /пример использования предыдущих операторов с дополнением фильтрации (WHERE Manufacturer = 'Apple') и получение таким образом среднего значения для определенной модели (в данном случа 'Apple')


SELECT COUNT(*) FROM products;
+----------+
| COUNT(*) |
+----------+
|        8 |
+----------+
1 row in set (0.01 sec) /использование агрегатной функции COUNT(*) для подсчета строк в таблице.

SELECT Manufacturer, COUNT(*) AS ModelsCount FROM Products GROUP BY Manufacturer HAVING COUNT(*) > 1;
+--------------+-------------+ 
| Manufacturer | ModelsCount |
+--------------+-------------+
| Apple        |           3 |
| Samsung      |           2 |
| Huawei       |           2 |
+--------------+-------------+
3 rows in set (0.00 sec) / ЗАПРОС ВЫВОДИТ ТОВАРЫ ВСЕХ ПРОИЗВОДИТЕЛЕЙ ДЛЯ КОТОРЫХ ОПРЕДЕЛЕНО БОЛЕЕ ОДНОЙ МОДЕЛИ ДЛЯ ЭТОГО В ЗАПРОСЕ 1. ОБРАЩАЕМСЯ К ТАБЛИЦЕ - FROM Products 2. выбираем поле SELECT Manufacturer 3. ПОДСЧИТЫВАЕМ КОЛЛИЧЕСТВО МОДЕЛЕЙ COUNT(*) 4. СОЗДАЕМ ДОПОЛИТЕЛЬНЫЙ СТОЛБЕЦ AS ModelsCount 5. ГРУПИРУЕМ ПО ПОЛЮ Manufacturer 6. ЗАДАЕМ УСЛОВИЕ ФИЛЬТРАЦИИ HAVING COUNT(*) > 1 (КОЛИЧЕСТВО СТРОК УДОВЛЕТВОРЯЮЩИХ УСЛОВИЯМ ФИЛЬТРАЦИИ БОЛЬШЕ ОДНОЙ СТРОКИ)

SELECT Manufacturer, COUNT(*) AS ModelsCount FROM Products WHERE Price * ProductCount > 80000 GROUP BY Manufacturer HAVING COUNT(*) > 1;
+--------------+-------------+
| Manufacturer | ModelsCount |
+--------------+-------------+
| Apple        |           3 |
| Huawei       |           2 |
+--------------+-------------+
2 rows in set (0.00 sec)  /В данном случае сначала фильтруются строки: выбираются те товары, общая	стоимость которых больше 80000. Затем выбранные товары группируются	по производителям. И далее фильтруются сами группы -выбираются те	группы, которые
содержат больше 1 моделию

 SELECT Manufacturer, COUNT(*) AS Models, SUM(ProductCount) AS Units FROM Products WHERE Price * ProductCount > 80000 GROUP BY Manufacturer HAVING SUM(ProductCount) > 2 ORDER BY Units DESC;
+--------------+--------+-------+
| Manufacturer | Models | Units |
+--------------+--------+-------+
| Apple        |      3 |    10 |
| Huawei       |      2 |    10 |
| HMD Global   |      1 |     6 |
+--------------+--------+-------+
3 rows in set (0.00 sec) /Обращаемся к таблице Products задаем условие в котором просит отоблазить товар с ценой 80000 и выше. Групируем по колличеству. Нас интересует поле ProductCount и оно должно быть больше двух. Сортировка Order by происходит по убыванию (сверху наибольшее, снизу наименьшее). Поле Units отвечает за колличество телефонов. Происходим суммирование по полю ProductCount для конкретного производителяб Общее колличество Айфонов завезенных на склад равно 10 и имеется 3 модели, т.е. нам удовлетворяют 3 строчки.  Имеется одна Нокиа. Т.е. модель одна а колличество телефонов 6. Тоже самое происходит с Хуавэем. Имеется одна модель, а  количества моделей равно 5. Таким образом мы отсортировали все имеющиеся группы по убыванию (от большего к меньшему).

UPDATE products SET ProductName = CONCAT("i ", ProductName) WHERE Produ
ctName LIKE '%Phone%';
Query OK, 2 rows affected (0.01 sec)
Rows matched: 2  Changed: 2  Warnings: 0 /ПРИМЕР ИСПОЛЬЗОВАНИЕ ОПЕРАТОРА LIKE '%Phone%' в условии WHERE для поиска в строке сочетания символов (в данном случае сочетания: Phone) и использования функции CONCAT ДЛЯ ДОБАВЛЕНИЯ СТРОЧНЫХ СИМВОЛОВ: "i " к значению поля ProductName соответственно имеющего тип VARCHAR.

SELECT AVG(Price) AS Average_Price FROM Products;
+---------------+
| Average_Price |
+---------------+
|    45750.0000 |
+---------------+
1 row in set (0.00 sec) /ИСПОЛЬЗОВАНИЕ АГРЕГАТНОЙ ФУНКЦИИ AVG. ПОЛУЧАЕМ СРЕДНЕЕ ЗНАЧЕНИЕ СТОЛБЦА

SELECT AVG(Price) FROM products WHERE Manufacturer = 'Apple';
+------------+
| AVG(Price) |
+------------+
| 53000.0000 |
+------------+
1 row in set (0.00 sec) /ИСПОЛЬЗОВАНИЕ AVG C ФИЛЬТРОМ WHERE

mysql> SELECT COUNT(*) FROM products;
+----------+
| COUNT(*) |
+----------+
|        8 |
+----------+
1 row in set (0.01 sec) /ИСПОЛЬЗОВАНИЕ АГРЕГАТНОЙ ФУНКЦИИ COUNT ДЛЯ ПОДСЧЕТА КОЛЛИЧЕСТВА СТРОК.

SELECT MIN(Price), MAX(Price) FROM products;
+------------+------------+
| MIN(Price) | MAX(Price) |
+------------+------------+
|      28000 |      76000 |
+------------+------------+
1 row in set (0.00 sec) / ПРИМЕР ИСПОЛЬЗОВАНИЯ АГРЕГАТНЫХ ФУНКЦИЙ MIN, MAX;


SELECT Manufacturer, COUNT(*) AS ModelsCount FROM Products GROUP BY Manufacturer;
+--------------+-------------+
| Manufacturer | ModelsCount |
+--------------+-------------+
| Apple        |           3 |
| Samsung      |           2 |
| Huawei       |           2 |
| HMD Global   |           1 |
+--------------+-------------+
4 rows in set (0.00 sec) /пример использования групировки (GROUP BY)
SELECT Manufacturer, COUNT(*) AS Models, SUM(ProductCount) AS Units FROM Products WHERE Price * ProductCount > 80000 GROUP BY Manufacturer HAVING SUM(ProductCount) > 2 ORDER BY Units DESC;
+--------------+--------+-------+
| Manufacturer | Models | Units |
+--------------+--------+-------+
| Apple        |      3 |    10 |
| Huawei       |      2 |    10 |
| HMD Global   |      1 |     6 |
+--------------+--------+-------+
3 rows in set (0.00 sec) /использование HAVING

CREATE TABLE orders (id INT NOT NULL AUTO_INCREMENT, PRIMARY KEY(ID), product_name VARCHAR(99) NOT NULL, price INT, total_price INT, coun INT); /СОЗДАЛИ ТАБЛИЦУ orders

CREATE TABLE sales (id INT NOT NULL AUTO_INCREMENT PRIMARY KEY, art VARCHAR(10), name VARCHAR(20), count INT DEFAULT 0,  price DECIMAL(8.2) DEFAULT 0); /СОЗДАЛИ ТАБЛИЦУ sales

ALTER TABLE sales ADD CONSTRAINT ord_sales FOREIGN KEY (`id_order`) REFERENCES orders(`id`); /создали связь между таблицами



